"Braziers sit in each corner of this room, providing illumination."
This padded room looks like it was once used for combat drilling.
"There is a wrestling ring in the corner, and at the far end of this long room are four archery targets, with multiple arrows embedded in each."
Unlit braziers are in each corner of this room.
"As you walk, you stir up dust from the soft, padded floor."
"On the back wall, racks of rusted weapons are arrayed, alongside a large amount of old wooden practice swords."
"Straw dummies lie prone on the floor, some intact, others wrecked."
There is a reek of stale sweat in here.
"The air in here is musty, and every step you take raises a little cloud of dust."
"The smell of moth-eaten tapestries permeates the air, and as you move about in in this strange, museum-like room, you are taken aback at the artefacts on display."
"Shrunken heads in glass cases, suits of armour, and shelves of ornate daggers from faraway lands catch your eye."
"There is a rack of exotic swords on display, and many ancient artworks, including one huge painting which appears to be a commissioned portrait of the Master of the Lair themselves! There are also several bookshelves loaded with rare tomes and some strange pieces of anatomy suspended in jars of preserving fluid."
"A noxious, rank odour just about knocks you flat as you enter this room."
"Every lair needs a privy, and this particular one appears to be undergoing heavy use."
This toilet is disgusting.
It consists of a wooden bench- seat against the back wall with a hold in it where one’s posterior is placed.
"Apparently uncleaned for a long time, the seat of this throne is stained and flies buzz about thickly in here."
It is all you can do to keep your last meal down.
A bucket of stagnant water and a mop sit in the corner.
"A fecal odour hits your nostrils, but it is somewhat subdued."
"Perhaps this privy has not been used in a while, but nonetheless it is not a pleasant place to linger, The walls are dirty, and a simple wooden bench with a hole in it sits against the back wall."
"A bucket, perhaps once used for cleaning, is knocked over on the floor with a dried up old mop nearby."
"The acrid tang of steel is heavy on the air, and on the far side of the room a forge emits a tremendous amount of heat."
The air is absolutely stifling in here.
"On the wall, tools are neatly arrayed, and large anvils are placed around this workshop space, accompanied by barrels of water where tools and metal components can be worked and shaped."
"Weapons, machines of war, vehicles, anything could be made in here."
"A large force, cold and unused, sits on the far side of this room."
"Tools lie here and there, some neatly arrayed on the walls, others scattered about the floor."
"Metal shavings and offcuts litter the floor, and anvils and hammers sit silent."
Piles of raw steel bars and timber sit waiting to be used.
"Entering, you find yourself in a Museum, dedicated to relics of the masters of piety of Asmodeus, Lord of Hell."
The walls are decorated with a plaque on the wall with the warning: 'The mythologic artist can only be acquired by eternally defeating the blocky ctene.
The floor is made of fitted sandstone flagstones.
A stinking coalition of Shuddering Horrors and Luminous Horrors defends the room.
"A large container of bubbling acid sits in a raised pouring machine, controlled by a lever and a button."
Concealed under a rug is a tunnel leading to a secret room containing a machine that controls things in the dungeon.
"In addition to the entrance, there are other exits on the northern, western and west sides."
"Entering, you find yourself in a Library, focused on tomes pertaining to Biology."
The walls are decorated with mosaics.
The piece displays a baker and a warrior haranguing a rewrite.
The action is set in a rural bell tower.
The piece is outlined in blood-red.
"The floor is made of warm, throbbing flesh."
A spiny conference of astral dreadnoughts led by a divine smoke drake defends the room.
"The room is on fire, and it's spreading."
"In addition to the entrance, there are two other exits on the west and southern sides."
This is a gracefully-carved island pine-wood door with a floral design.
It is decorated with an engraving: the main scene exhibits heterophyllys dramatising.
The scene takes place in a dim swamp at sunset.
A scorched factory is hidden in the distance.
It is unlocked.
It is not trapped.
This is a mandrake-wood door with electrum bands.
It is unlocked.
It is magically trapped.
The trigger is when you step on the threshhold.
The effect of the trap is an electric shock.
This is a intricately-carved fey elm-wood door with a floral design.
It is unlocked.
It is magically trapped.
The trigger is when any part of the door is touched by anything.
The effect of the trap is a rock that drops.
"Entering, you find yourself in a Library, focused on books pertaining to Cartographical Sciences."
"The walls are decorated with a plaque on the wall with the epigram: 'We are all now scurry, leaving you only our foliation.'."
"The floor is made of rough, solid granite."
A sadistic herd of mud mephits led by a taunting firenewt defends the room.
"Monsters are safely nested in a pillbox balcony, shooting at players below and then ducking for full cover."
There are no other exits to the room.
"Entering, you find yourself in a Theatre, designed to host opera."
The walls are decorated with bookshelves with texts of Crystal Annals.
"The floor is made of warm, throbbing flesh."
A bellowing alliance of ettercaps led by a heinous red dragon defends the room.
A gushing stream of rot grubs pours out from a hole in the wall and down into a crack in the floor.
"In addition to the entrance, there is one other exit on the northwestern side."
"Entering, you find yourself in a Mining tunnels, dug in pursuit of a vein of iron."
The walls are decorated with bookshelves with texts of Abjuration.
"The floor is made of rough, solid granite."
A brutal flock of meazels led by a foul steam mephit defends the room.
Someone has created a barricade across the midpoint of the room out of wooden furniture.
Concealed in a crawlspace behind a desk is a tunnel leading to a secret room containing a precious key that will open dungeon doors.
"In addition to the entrance, there are two other exits on the south and western sides."
This is a sturdy door of sealed mandragora-wood with tin bolts.
It is decorated with art: the scene shows a warrior expressing desperate gentility.
The scene is set in a deep arsenal.
It is unlocked.
It is not trapped.
This is a intricately-carved baobab-wood door with a geometric design.
It is decorated with an engraving: the image focuses on an elephant accompanying a strange wheeled vehicle through a lake.
"Overall, the image feels expressible.It is unlocked."
It is magically trapped.
The trigger is when any part of the door is touched by anything.
The effect of the trap is a slashing swing-blade.
This is a sturdy door of sealed spruce-wood with lead bolts.
"It is decorated with art: the scene is of a horde of rhoas seated on comfortable furniture, viewing a film."
The action is set in a windy glacier in the rain.
It is unlocked.
It is not trapped.
"Entering, you find yourself in a Office, designed for landowners."
"The walls are decorated with a plaque on the wall with the saying: 'When you phrase unknowingly, you will know that the time has come.'."
"The floor is made of warm, throbbing flesh."
A massive force of Modrons and Modron Heirarch defends the room.
Concealed behind a mosaic of a bitten arnica is a tunnel leading to a secret room containing sleeping enemies.
"In addition to the entrance, there is one other exit on the east side."
"In addition to the entrance, there is one other exit on the eastern side."
"An aura of silence fills this room, it's impossible to make a sound."
A leering cluster of yuan-ti broodguards led by a savage berserker defends the room.
"The floor is made of rough, solid sandstone."
"Entering, you find yourself in a Classroom, which once taught History."
There are a few desks and many bookshelves.
The walls are decorated with frosted triangular windows.
"This room is a small, rough oblong, it may have once been a chantry."
Faerie fire lines any living creature entering the area (brightening an area 5 ft.
around her by one step).
It smells of urine in this place.
The floor's maker crafted it to amplify the sounds of those traversing it; it inflicts a -8 penalty to Stealth checks.
'Lose 1 turn' is written in chalk on the floor.
"The wall possesses 1d3 barred windows; if underground, each window is fitted with an everburning torch."
The wall has been used as a canvas by an obviously talented artist.
A large inverted dome dominates much of the ceiling.
"When commanded (DC 22 arcana or history check reveals command word), the dome appears to open like a gigantic eye which moves and blinks."
The eye can cast scry once a week.
"Long, thick viscous globules of a dark brown slime hang down from the rough stone ceiling."
A reasonably maintained door made of stone with a solid lock (DC 16 to open).
"You notice the lock resembles a fish, with a hook for a ring and the keyhole in a fin."
The door is false and it does not open.
Removing it reveals a blank stone wall.
"The metal hinges and fittings of the door are still fixed to the wall, or lying nearby."
There is no sign of the door itself.
The room contains traces of previous explorers: a bent crowbar lies discarded in a doorway with a partially opened stone door.
The room also has evidence of previous explorers: a makeshift skiff rests along the opposite bank of this placid underground lake.
"This room is a medium sized, rough diamond, it was once an assembly Hall."
"A paper lantern floats through the air, the heat from its candle causing it to drift in a gentle breeze."
Specific places within the area have the faint stink of sour milk about them.
The stone floor is cut such that it spirals downward a total of ten feet before reaching a small hole in the room's centre.
A single skeletal arm reaches through the floor and attempts to grasp at one of the character's legs; the arm does nothing afterwards.
A deity's holy (or unholy) symbol is prominently painted on the wall.
"A dark spirit passed through the wall, sapping it and all of its dressings of any resemblance of warmth, cheer or good tidings."
An expansive and vivid fresco is expertly painted onto the plaster ceiling.
A DC 18 (religion) check reveals the figures to be long forgotten deities.
The impaled body of a humanoid lies on the floor grasping a stalactite which has broken off from the ceiling above.
An iron shouldered archway decorated with clouds.
A complex mosaic forms the border of the archway.
Tiny glass tiles form a rampant griffin.
The archway and nearby walls are water stained up to the ceiling.
The room contains a spell trap.
It is triggered by a tripwire and casts flame strike.
The room also has a bulky chest.
A layer of dust has settled on top of this otherwise invisible chest.
The room also has a bulky chest.
Blazing brass letters on top of this chest proclaim “DO NOT OPEN.”
Half‐a‐dozen lockets hang from hooks embedded in this chest’s lid; each has an etching of a different woman’s face."This room is a small, rough square, its initial function was as a meeting chamber."
Green crystals radiate an oddly nauseating light.
(Any creature that can see is sickened for 1 hour unless it makes a DC 15 Fortitude save.) The area has a strange alchemical smell of formaldehyde and other bizarre preserving ingredients and reagents.
"The metal floor is magnetized; characters wearing metal armour move at half speed, attacks with metal weapons have a –2 penalty and dropped metal items require a DC 12 Strength check to prize from the floor."
A crude drill stands upright here; the iron bit has only penetrated the floor by about an inch.
"1d12 prisoners were sealed within the wall, their cells marked by small, barred openings from which their remains can be viewed."
"Several love letters have been stuck to the wall; at the GM’s decision, these letters may require translation from an exotic tongue."
A dais when stood upon levitates up to the ceiling (a segment of which retracts enabling access to the section above).
A section of one of the pillars has broken and a metal strong box is wedged in the gap to support the ceiling.
A crystal ogee archway decorated with magical sigils or runes.
"This stacked archway features large rib bones, whose tips extend out like overlapping fingers."
A difficult check reveals them to be dragons’ ribs.
Glowing ichor covers the floor.
It appears to be the blood of some creature.
The room contains a very well maintained pull down tapestry.
Vividly coloured and highly decorative this tapestry depicts a symbolic telling of a well‐known children’s story.
The room also has a coffin or sarcophagus.
"The sarcophagus is aligned towards a significant site such as a religious site, secret city or unimaginable treasure."
"One at a time, the nails holding this makeshift coffin start working their way loose while the PCs watch."
"Once free, they fall to the floor with an audible “plink.”."
"This room is a large, rough oblong, it was once used as a training room."
"Strobe light emanates from a lantern, using a heat‐spinning shade."
This area has a bitter and unpleasant acrid smell almost strong enough to burn the nose.
"The obsidian floor’s centre features a gold sun (worth 4,000 gp if removed intact - DC 25 check) with stylized rays, the longest of which point to the exits."
A thick fog roils up from the floor to a height of five feet; creatures in the fog gain concealment and treat everything else as having concealment.
The wall has been painted in an exotic colour.
"The wall is leaking a green, slimy substance."
The plain white plaster ceiling is decorated by red handprints made by many different individuals.
A shoeless body lies broken on the floor.
A DC 13 Perception check spots shoes stuck to the ceiling.
A reasonably maintained door made of stone with an average lock (DC 12 to open).
"You notice beneath the keyhole, the crest of a noble family is embossed in brass."
The doorsill is a significant step up.
It costs 2 squares of movement to enter the square containing the door.
"A sign is pasted on the door, reading “EGRESS” in ornamental capitals."
The room contains the dry remains of a corpse (DC 13 medicine check determines the body has been here for 5 months).
It has wounds from bludgeoning damage (DC 16 check determines).
The room also has a reasonably sized chest.
"This chest seems to have been grown from a single small tree, trained into chest shape."
A statue (that points at the chest) stands in one corner of the room The theatre masks in this chest evoke both hilarity and tragedy in their expressions.
The room contains a large chest.
"This is an impressive iron chest, tarnished on every surface but at the lock."
The lock of this chest consists of sliding panels that create a puzzle.
This chest holds vials of water of varying degrees of clarity and filth.
"This room is a medium sized, rough hexagon, it was originally an amphitheater."
It is completely dark.
You hear a roar from elsewhere in the dungeon.
The stone floor slopes downward to the east; the western side sits one foot higher.
A small campsite occupies one of the room’s corners; two bedrolls and the ashen remains of a fire mark the site.
The wall was designed as a gauntlet and possesses 2d4 manhole‐type openings.
"The wall has been altered by warp wood, stone shape or a similar effect into an imperfect form."
"The flat, unadorned ceiling has a domed aperture in the centre from which hangs a large, ornate iron pentagram‐shaped candelabrum."
"A long, thin ladder leans against the wall."
A pot of whitewash balances on the top rung.
A well conditioned door made of strong wood without a lock.
An elaborate baroque doorknocker is fixed to the door.
The door’s key has been left in the lock on the party’s side.
"The room contains a huge statue made of iron, the details of which become apparent."
A sitting beggar clad in a worn and patched cloak holds up a bowl.
Bandages cover the man’s eyes.
The room also has a small chest.
A distinct rune of pale wood is inlaid in the darker mahogany lid of this chest.
This chest is covered in some kind of black mould.
"This chest contains homemade candles, some unused, others barely a nub of wax and wick."
"This room is a large, rough oblong, it was once a dormitory."
Only dim light can be seen in the room.
You hear chiming from elsewhere in the dungeon.
The marble floor does not meet the wall on any side; the two‐inch gap separating the floor from the wall reveals nothing.
“Lose 1 turn” is written in chalk on the floor.
An intricate carving of a mythical place decorates the wall.
Countless fist‐sized holes dot the wall.
A wasp swarm makes its home in these holes.
A large stone medallion of an eight‐pointed star embellishes the groin‐vaulted ceiling.
The paint and plaster on the ceiling has thinned enough to make out the sigil of a deity beneath.
A DC 14 (religion) check reveals it as the symbol of the goddess of ill fortune.
A well conditioned door made of strong wood with a simple lock (DC 8 to open).
"You notice a rectangular panel etched to resemble a spellbook, latching where pages should be."
The door is painted with a crude portrait of whoever or whatever lives within.
"The door casts its own dim shadow outward, independent of all light."
"The room contains a huge statue made of magically treated glass, the details of which become apparent."
"This creature has a lion’s body and three heads: a lion’s, a dragon’s and a horned goat (a chimera; DC 17 Arcana)."
The room also has graffiti in places.
"Thousands of “B”s written in black ink, in a myriad of scripts and styles, cover the floor."
"This room is a small, rough hexagon, it was once an aviary."
Only partial light is seen in the room.
You hear the sound of stone sliding from elsewhere in the dungeon.
The floor is merely hard‐packed dirt with no other remarkable features.
Soapy water covers a section of the floor and an abandoned mop lies near the puddle of water.
The wall was designed to act as a fountain and utilizes a hidden decanter of endless water to achieve this effect.
The wall has been smeared with a foul‐smelling substance by a superstitious denizen.
An expansive and vivid fresco is expertly painted onto the plaster ceiling.
A DC 18 (religion) check reveals the figures to be long forgotten deities.
A fresco of a ruling noble has been vandalised with the words “Power to the rebellion.” A reasonably maintained set of double doors made of simple wood without a lock.
The doorsill is a significant step up.
It costs 2 squares of movement to enter the square containing the door.
Sticky black tar has been daubed on the door.
Drips and splatters cover the floor nearby.
The room contains a bulky chest.
"The chest is divided down the middle, creating two distinct containers."
It has two lids.
"Though it appears to be well‐maintained, the chest opens with a loud creak."
A DC 20 Perception check reveals this fact before the chest is opened.
The room also has a mirror.
"Hidden partly by a green velvet curtain, the glass in this silver frame is all but shattered."